{
  "title": "AI Reel Builder Automation",
  "slug": "reel-builder-automation",
  "meta": {
    "description": "See how Projekt AI turns simple text inputs into polished, social-ready reels in minutes using an end-to-end AI automation pipeline.",
    "keywords": [
      "AI automation",
      "video automation",
      "reel builder",
      "social media",
      "content creation"
    ],
    "featuredImage": "/assets/img/portfolio/reel-builder-card-social.jpg"
  },
  "hero": {
    "subtitle": "Turn simple profile inputs into polished, social-ready video reels in under five minutes – no editing skills required.",
    "client": "Music Industry Creators",
    "industry": "Music & Entertainment",
    "category": "Video Automation",
    "stats": [
      {
        "value": "95%",
        "label": "Time Saved"
      },
      {
        "value": "<$0.50",
        "label": "Cost / Reel"
      },
      {
        "value": "2 min",
        "label": "Turnaround"
      },
      {
        "value": "24/7",
        "label": "Availability"
      }
    ],
    "image": "/assets/img/portfolio/reel-builder-workflow.png",
    "video": "/assets/videos/automation-overview.mp4"
  },
  "challenge": {
    "overview": "Creating engaging social media content demands significant time and expertise, especially for music creators who need to maintain a consistent presence across multiple platforms.",
    "points": [
      {
        "title": "Time Constraints",
        "description": "Music producers and DJs have limited time to create professional-quality social media content while focusing on their craft."
      },
      {
        "title": "Technical Barriers",
        "description": "Many creators lack video editing skills but need professional-quality reels to promote their music and performances."
      },
      {
        "title": "Consistency Issues",
        "description": "Maintaining consistent branding and messaging across multiple social platforms creates significant overhead."
      }
    ]
  },
  "solution": {
    "overview": "We built an end-to-end automation system that transforms simple text inputs into polished, branded video reels ready for social media.",
    "points": [
      {
        "title": "Multi-Channel Input",
        "description": "Users can submit content via Telegram bot, WhatsApp, Airtable form, or web interface."
      },
      {
        "title": "AI-Driven Content Generation",
        "description": "GPT-4 transforms basic inputs into compelling captions, calls-to-action, and motion graphics text."
      },
      {
        "title": "Template-Based Rendering",
        "description": "Dynamic templates with brand colors, motion graphics, and music ensure consistent high-quality output."
      }
    ]
  },
  "workflow": {
    "overview": "The automation process follows a streamlined workflow from input to distribution, with minimal human intervention required.",
    "steps": [
      {
        "title": "Input Collection",
        "description": "User provides basic information through their preferred channel (Telegram, WhatsApp, web form).",
        "image": "/assets/img/workflow/input-collection.png",
        "details": ["User-friendly interface", "Multiple input channels", "Minimal required fields"]
      },
      {
        "title": "Content Enhancement",
        "description": "AI processes the input to generate optimized captions, hashtags, and motion graphics text.",
        "image": "/assets/img/workflow/ai-enhancement.png",
        "details": ["GPT-4 optimization", "Industry-specific hashtags", "Brand voice consistency"]
      },
      {
        "title": "Media Assembly",
        "description": "System pulls audio samples, brand elements, and background visuals to create the reel elements.",
        "image": "/assets/img/workflow/media-assembly.png",
        "details": ["Dynamic template system", "Brand-consistent elements", "Audio visualization"]
      },
      {
        "title": "Rendering & Delivery",
        "description": "Cloud-based rendering combines all elements and delivers the finished reel back to the user.",
        "image": "/assets/img/workflow/rendering-delivery.png",
        "details": ["Cloud processing", "Multiple output formats", "Direct delivery"]
      }
    ]
  },
  "results": {
    "overview": "The automation system has dramatically reduced content creation time while maintaining high-quality output.",
    "metrics": [
      {
        "title": "Time Efficiency",
        "value": "95%",
        "description": "Creation time reduced from 2 hours to 5 minutes per reel.",
        "icon": "fas fa-clock"
      },
      {
        "title": "Cost Reduction",
        "value": "90%",
        "description": "Cost per reel reduced from $50-100 to less than $0.50 each.",
        "icon": "fas fa-dollar-sign"
      },
      {
        "title": "Content Volume",
        "value": "300%",
        "description": "Clients can produce 3x more content with the same resources.",
        "icon": "fas fa-chart-line"
      },
      {
        "title": "Engagement",
        "value": "+42%",
        "description": "Average increase in engagement across automated reels.",
        "icon": "fas fa-thumbs-up"
      }
    ],
    "testimonial": {
      "quote": "The automation system has completely transformed our content strategy. We're posting more consistently and seeing better results, all while spending less time on production.",
      "name": "Alex Thompson",
      "position": "Music Producer & DJ"
    }
  },
  "technical": {
    "overview": "The system uses a modern stack focused on cloud-based media processing and AI integration.",
    "stack": [
      {
        "category": "AI & Machine Learning",
        "tools": [
          {
            "name": "OpenAI GPT-4",
            "icon": "fa-solid fa-brain"
          },
          {
            "name": "Azure Cognitive Services",
            "icon": "fa-solid fa-microchip"
          }
        ]
      },
      {
        "category": "Media Processing",
        "tools": [
          {
            "name": "FFmpeg",
            "icon": "fa-solid fa-film"
          },
          {
            "name": "AWS Media Convert",
            "icon": "fa-brands fa-aws"
          }
        ]
      },
      {
        "category": "Automation & Workflow",
        "tools": [
          {
            "name": "Make.com",
            "icon": "fa-solid fa-cogs"
          },
          {
            "name": "Airtable",
            "icon": "fa-solid fa-table"
          },
          {
            "name": "Telegram API",
            "icon": "fa-brands fa-telegram"
          }
        ]
      }
    ]
  },
  "related": [
    {
      "title": "Club77 Content Pipeline",
      "slug": "club77-content-pipeline",
      "image": "/assets/img/portfolio/club77-content-pipeline-card.png"
    },
    {
      "title": "DJ Recording Manager",
      "slug": "dj-recording-manager",
      "image": "/assets/img/portfolio/dj-recording-manager-card.jpg"
    },
    {
      "title": "Proposal Automation",
      "slug": "upwork-proposal-automation",
      "image": "/assets/img/portfolio/client-proposals-card.jpg"
    }
  ],
  "cta": {
    "title": "Ready to Build Reels On Autopilot?",
    "text": "Get a customized blueprint for your music brand – we'll break down costs, integrations and ROI.",
    "buttonText": "Request Blueprint",
    "buttonUrl": "mailto:hello@projekt-ai.net?subject=Reel%20Builder%20Blueprint%20Request"
  }
} 